{
  "$schema": "https://json-schema.org/draft/2020-12/schema",
  "title": "M6 运行点文件（双带阈值 + OOD 判定参数；qa-m6 管理）",
  "description": "configs/m6-runpoint-*.json 的 schema（qa 拥有与冻结；deveng 推理器加载、评测 harness 引用）。标定纪律：只能用 data/m6/ 的 dev 切分标定（challenge/heldout/ood 与 data/heldout/ 冻结套件绝不参与标定）；运行点文件变更=新文件+登记，不原地改。",
  "required": ["schema", "schema_version", "runpoint_id", "calibrated_on", "thresholds", "ood"],
  "additionalProperties": false,
  "if": {
    "properties": { "threshold_space": { "const": "logit" } },
    "required": ["threshold_space"]
  },
  "then": {
    "properties": {
      "thresholds": {
        "properties": {
          "T1": { "required": ["flag_logit", "strong_logit"] },
          "T2": { "required": ["flag_logit", "strong_logit"] },
          "T3": { "required": ["flag_logit", "strong_logit"] },
          "T4": { "required": ["flag_logit", "strong_logit"] },
          "T5": { "required": ["flag_logit", "strong_logit"] }
        }
      }
    }
  },
  "properties": {
    "schema": { "const": "m6-thresholds" },
    "schema_version": { "$ref": "m6-common.schema.json#/$defs/SchemaVersion" },
    "runpoint_id": { "type": "string", "pattern": "^m6-[a-z0-9][a-z0-9.-]*$", "description": "如 m6-runpoint-v1（qa 定稿）/ m6-v1-init（ckpt 初始 calib，deveng 产出、qa 重冻结）" },
    "created": { "$ref": "m6-common.schema.json#/$defs/Timestamp" },
    "owner": { "type": "string", "description": "产出方：qa-m6（定稿 runpoint，configs/m6-runpoint-*.json）或 deveng-m6（ckpt 初始 calib.json，标注 initial、qa 重冻结）" },
    "calibrated_on": {
      "type": "object",
      "required": ["split"],
      "additionalProperties": false,
      "properties": {
        "split": { "const": "dev" },
        "manifest": { "type": "string", "description": "data/m6/manifest.json 的 manifest_id + sha256（标定时的清单指纹；qa 定稿 runpoint 必填，ckpt 初始 calib 可缺省）" },
        "n": { "type": "integer", "minimum": 1 },
        "method": { "type": "string", "description": "标定方法（如：τ_flag 取 dev 上 FPR<=0.4% 的最大召回点；τ_strong 取 dev 攻击分布 P99 分位下确界；logit 空间校准：τ_l = neg_max_logit + δ, δ=1.0）" },
        "curves": { "type": "string", "description": "阈值敏感性曲线数据文件路径（reports/m6/）" }
      }
    },
    "thresholds": {
      "type": "object",
      "required": ["T1", "T2", "T3", "T4", "T5", "T6"],
      "additionalProperties": false,
      "properties": {
        "T1": { "$ref": "m6-common.schema.json#/$defs/ThresholdBand" },
        "T2": { "$ref": "m6-common.schema.json#/$defs/ThresholdBand" },
        "T3": { "$ref": "m6-common.schema.json#/$defs/ThresholdBand" },
        "T4": { "$ref": "m6-common.schema.json#/$defs/ThresholdBand" },
        "T5": { "$ref": "m6-common.schema.json#/$defs/ThresholdBand" },
        "T6": { "$ref": "m6-common.schema.json#/$defs/ThresholdBand" }
      }
    },
    "temperatures": {
      "type": "object",
      "additionalProperties": false,
      "description": "温度元数据（adr-1b §6.1：v1 撤销温度缩放——实测 NLL 最优 T→0 使 σ(logit/T) 饱和、破坏双带分数分辨率。score = σ(logit) 原始尺度，全部阈值在该尺度定标；本块仅作记录性元数据 + CLI 开关保留，不参与决策，v2 LoRA 后可复议）",
      "properties": {
        "T1": { "type": "number", "exclusiveMinimum": 0 },
        "T2": { "type": "number", "exclusiveMinimum": 0 },
        "T3": { "type": "number", "exclusiveMinimum": 0 },
        "T4": { "type": "number", "exclusiveMinimum": 0 },
        "T5": { "type": "number", "exclusiveMinimum": 0 },
        "T6": { "type": "number", "exclusiveMinimum": 0 }
      }
    },
    "threshold_space": {
      "enum": ["logit", "score"],
      "description": "ADR-2 D-16（logit 域统一）：校准/决策/敏感性曲线/OOD 距离的运算域。\"logit\" = 全链 logit 域（score 概率值降级为显示层，fp64 计算或分带显示\">0.9999\"）；此时 sigmoid 任务（T1-T5）阈值条目**必须**携带 *_logit 键（schema if/then 强制），消费者存在即必须 logit 比较——硬失败优于静默换轨（D-7 家族纪律：同族三案 §6.1 温度撤销→v1-1 τ 帽→fp32 饱和 391 显示层事件）。T6 softmax 概率豁免。\"score\" = v1 代概率空间（历史 runpoint）"
    },
    "ood": {
      "type": "object",
      "required": ["mechanism"],
      "additionalProperties": false,
      "properties": {
        "mechanism": { "const": "mahalanobis-aux" },
        "tau_ood": { "type": "number", "minimum": 0, "description": "OOD 距离阈值（原始 Mahalanobis 距离口径；logit 域运行点 = logit 空间距离；定标 = dev-benign 距离 q99.5，定标集须含长度匹配样本防长文漂移误判）" },
        "is_ood_rule": { "const": "min(d_benign,d_attack) > tau_ood" },
        "centers_ref": { "type": "string", "description": "类条件高斯中心/协方差文件（如 checkpoints/m6-v1/ood_centers.json）——**suppression_mode 的实际开关在此文件**（deveng 7082d30：runpoint 可选 two-band 默认 / strong-too 扩展抑制至强带，qa signal-3/task-10 G4，OOD 套件 default-PASS 修复；对既有运行点字节不变）" },
        "suppression": {
          "enum": ["two-band", "strong-too"],
          "description": "抑制规则：two-band（ADR-1 §8 默认：仅弱带 (τ_flag, τ_strong] 分数可被 OOD 抑制；score>τ_strong 永不抑制——强信号防线）；strong-too（is_ood 抑制扩展至强带，OOD 套件读数用；模式实际由 centers_ref 文件承载，此处为运行点自述）"
        }
      }
    },
    "calibration_method": {
      "type": "object",
      "additionalProperties": false,
      "properties": {
        "strategy": { "const": "joint-or-gate", "description": "D8 联合 OR 门校准：网格搜索 (τ_flag_1..6)，约束 = 并集决策在 dev-benign ∪ dev-challenge-mirror 上 FP=0 且 margin≥δ，最大化加权力 recall" },
        "tau_strong_rule": { "const": "max(dev真阳分数q10, tau_flag+margin)" },
        "margin_delta": { "type": "number" },
        "curves": { "type": "string", "description": "(τ, recall, FP) 三元组曲线数据文件（reports/m6/）——敏感性分析 Lead 换点依据（ADR §10-4）" }
      }
    },
    "temperature_applied": {
      "type": "boolean",
      "description": "决策是否应用了温度缩放（adr-1b §6.1：v1 撤销——默认 false；与 temperatures 元数据块互为印证）"
    },
    "score_def": {
      "type": "string",
      "description": "score 语义声明（如 \"sigmoid(logit); T6 = P(high-risk)\"——与 adr-1b §6.1 同源）"
    },
    "curves": {
      "type": "object",
      "description": "每任务阈值敏感性曲线（ckpt 初始 calib 随附；qa 定稿 runpoint 可用 reports/m6/ 路径替代）",
      "additionalProperties": {
        "type": "array",
        "items": {
          "type": "object",
          "required": ["tau", "recall", "fp", "n_neg"],
          "additionalProperties": false,
          "properties": {
            "tau": { "type": "number", "description": "扫描阈值（与该任务阈值同空间：sigmoid 任务为 score/logit，T6 为概率）" },
            "recall": { "type": "number", "minimum": 0, "maximum": 1 },
            "fp": { "type": "integer", "minimum": 0 },
            "n_neg": { "type": "integer", "minimum": 0 }
          }
        }
      }
    },
    "applies_to": {
      "type": "object",
      "properties": {
        "model_id": { "type": "string" },
        "heads_sha256": { "$ref": "m6-common.schema.json#/$defs/Sha256" }
      },
      "additionalProperties": false,
      "description": "运行点绑定的探针头指纹（换头必须重标定）"
    },
    "notes": { "type": "string" },
    "git_sha": { "type": "string" }
  }
}
