{
  "schema": "m6-thresholds",
  "schema_version": "0.1.0",
  "runpoint_id": "m6-runpoint-v5",
  "created": "2026-10-22 10:55:03",
  "owner": "qa-m6",
  "calibrated_on": {
    "split": "dev",
    "manifest": "b63ca95d5c83d62c57d866e1c7fc743f6065ab5f9e842460660a25ab4370f577",
    "n": 13389,
    "method": "QA-1 §4.1 (v1.3.2): τ_flag 预注册网格 25 档 {0.05..0.95, 0.96..0.999}，可行域 dev-FPR<=0.4% & dev-chmirror-FPR<=0.08%，argmax recall 并列取保守；τ_strong = max(dev真阳q10, τ_flag+0.05)；τ_ood = dev负例距离q99.5"
  },
  "thresholds": {
    "T1": {
      "threshold_space": "logit",
      "flag": 1.0,
      "strong": 1.0,
      "flag_logit": 35.76,
      "strong_logit": 36.76
    },
    "T2": {
      "flag": 0.15,
      "strong": 1.0
    },
    "T3": {
      "flag": 0.97,
      "strong": 1.0
    },
    "T4": {
      "flag": 0.99,
      "strong": 1.0
    },
    "T5": {
      "flag": 0.98,
      "strong": 1.0
    },
    "T6": {
      "flag": 0.999,
      "strong": 1.0
    }
  },
  "ood": {
    "mechanism": "mahalanobis-aux",
    "tau_ood": 4896.3444,
    "is_ood_rule": "min(d_benign,d_attack) > tau_ood",
    "suppression": "two-band"
  },
  "notes": "QA 独立选点（交叉验证 deveng calib.json 推荐点用）；detail={'T1': 'NO-FEASIBLE-POINT', 'T2': 'OK', 'T3': 'OK', 'T4': 'OK', 'T5': 'OK', 'T6': 'OK'}；score 域无可行任务继承 calib logit 域阈值: ['T1']（score 饱和致网格失效，logit 域为忠实替代）"
}